{
  "schema_version": "ava-pdf-job-1",
  "operation_id": "operation-fixture",
  "owner_id": "owner-fixture",
  "library_item_id": "item-fixture",
  "intent": "initial_pdf_import",
  "profile_id": "ava-pdf-prose-en-v2",
  "source": {
    "id": "artifact-source",
    "role": "SOURCE_PDF",
    "format": "PDF",
    "media_type": "application/pdf",
    "path": "source/input.pdf",
    "sha256": "aaaaaaaaaaaaaaaaaaaaaaaaaaaaaaaaaaaaaaaaaaaaaaaaaaaaaaaaaaaaaaaa",
    "byte_length": 128
  },
  "request_sha256": "dddddddddddddddddddddddddddddddddddddddddddddddddddddddddddddddd",
  "config_sha256": "eeeeeeeeeeeeeeeeeeeeeeeeeeeeeeeeeeeeeeeeeeeeeeeeeeeeeeeeeeeeeeee",
  "worker_fingerprint": "ffffffffffffffffffffffffffffffffffffffffffffffffffffffffffffffff",
  "generation": 1,
  "attempt_fence": 1,
  "cancellation_epoch": 0,
  "provider_mode": "native",
  "active_deadline_seconds": 1800,
  "source_page_limit": 500,
  "scratch_byte_limit": 2147483648
}
